{
  "review_id": "REV-105",
  "candidate_id": "CC-105",
  "review_status": "Approved",
  "reviewed_at": "2026-06-28T16:00:00+00:00",
  "reviewer": "Sandbox Reviewer",
  "decision": "Approve",
  "notes": "Manual sample approval for Review Pipeline validation.",
  "verified_case_id": "VC-105",
  "model_impact": "repository_only"
}
